{
  "schema_version": "1.0.0",
  "event_id": "55555555-5555-4555-8555-555555555555",
  "case_id": "11111111-1111-4111-8111-111111111111",
  "sequence": 2,
  "event_type": "SOURCE_PINNED",
  "actor": {
    "type": "USER",
    "id": "regulatory-analyst-001",
    "agent_ref": null
  },
  "entity_ref": {
    "entity_type": "CASE_SOURCE",
    "entity_id": "22222222-2222-4222-8222-222222222222",
    "entity_version": 1,
    "entity_hash": "aaaaaaaaaaaaaaaaaaaaaaaaaaaaaaaaaaaaaaaaaaaaaaaaaaaaaaaaaaaaaaaa"
  },
  "outcome": {
    "status": "RECORDED",
    "reason_code": null,
    "summary": "Pinned immutable FDA document version to the case.",
    "reference_ids": ["77777777-7777-4777-8777-777777777777"]
  },
  "correlation_id": "12121212-1212-4212-8212-121212121212",
  "causation_event_id": null,
  "occurred_at": "2026-09-04T01:01:00Z",
  "append_only": true
}
